{
  "$schema": "openslope-effects-v1.schema.json",
  "kind": "openslope-effects",
  "version": 1,
  "target": {
    "game": "ssx-tricky",
    "platform": "ps2",
    "region": "pal",
    "executable": "SLES-50545",
    "level": "TEST"
  },
  "header": {
    "U1": 1966592,
    "U2": 1053952,
    "U3": 0.006
  },
  "slots": [
    {
      "id": "slot:test",
      "name": "Test persistent emitter",
      "circumstances": {
        "persistent": "graph:test-emitter",
        "collision": null,
        "slot3": null,
        "slot4": null,
        "trigger": null,
        "slot6": null,
        "slot7": null
      }
    }
  ],
  "graphs": [
    {
      "id": "graph:test-emitter",
      "name": "Test emitter",
      "nodes": [
        {
          "id": "node:test-emitter",
          "mainType": 2,
          "semanticType": "particle.timer",
          "payload": {
            "type2": {
              "SubType": 0,
              "type2Sub0": {
                "U0": 1,
                "U1": 1,
                "U2": 60.0,
                "U3": 1.0,
                "U4": 10.0,
                "U5": 0.0,
                "U6": 10.0,
                "U7": 0.0,
                "U8": 0.0,
                "U9": 1.25,
                "U10": -2.5,
                "U11": 3.75,
                "U12": 0.0,
                "U13": 0.0,
                "U14": 0.0,
                "U15": 0.0,
                "U16": 0.0,
                "U17": 0.0,
                "U18": 0.0,
                "U19": 0.0,
                "U20": 0.0,
                "U21": 0.0,
                "U22": 0.0,
                "U23": 0.0,
                "U24": 0.0,
                "U25": 0.0,
                "U26": 0.0,
                "U27": 0.0,
                "U28": 0.0,
                "U29": 0.0,
                "U30": 0.0,
                "U31": 0.0,
                "U32": 0.0,
                "U33": 1.0,
                "U34": 1.0,
                "U35": 1.0,
                "U36": 1.0,
                "U37": 1.0,
                "U38": 1.0,
                "U39": 1.0,
                "U40": 1.0,
                "U41": 1.0,
                "U42": 1.0,
                "U43": 1.0,
                "U44": 1.0,
                "U45": 1.0,
                "U46": 1.0,
                "U47": 1.0,
                "U48": 1.0,
                "U49": 0,
                "U50": 1
              }
            }
          },
          "references": {}
        }
      ]
    }
  ],
  "functions": [],
  "objectProperties": [
    {
      "id": "property:test",
      "data": {
        "U0": 0.0,
        "PlayerBounce": 0.0,
        "U2": 0,
        "BitFlags": 1,
        "SurfaceType": 0,
        "CollsionMode": 0,
        "U8": 0
      },
      "references": {
        "effectSlot": "slot:test",
        "physics": null,
        "collisionModel": null
      }
    }
  ],
  "instances": [
    {
      "id": "instance:test",
      "property": "property:test"
    }
  ],
  "physics": [],
  "collisionModels": [],
  "splines": [],
  "extensions": {}
}
